,blog
0,  
1,"Sleep was terrible. Major chest pain (ribs) and my rice n' lamb did not seem happy in me gut. Fallout from the accident? Finally fell asleep and woke up fine. It is almost noon and no news from my bike yet so I will likely be in Gisborne until tomorrow. Hopefully my bike will be fixed today cos I dont think the shops are open tomorrow and Northerlies are expected to be picking-up by tuesday - I plan on a 2 to 3 days to go North to Opotiki and fish on the way. I'll see how the cookie crumbles. Got me an orange safety vest this morning. Probably one of the best 20$ I'll have spent during this trip. Better than the red wine 2 days ago! ;) Also on the shopping list is groceries for 3 days... rice, pasta, peanut butter, bread... the ol' basic taka. Well thats it, another forced day off, but the weather is beautiful and Gisbourne is a nice place. I'll go for a soda on the beach. Cheers, Rene This just in... my bike will only be ready on Tuesday (today is Saturday). I will take a bus to Napier tomorrow and visit the Art Deco City for a day. Hopefully I'll be on the road not too late on Tuesday and make it over the the Waioeka river (about 100Km with a 700 - some meters climb). Oh well, thats the way it goes...     "
2,"The bus ride was an interesting experience. We were about 8 passengers in a big coach bus and the driver/surfer entertained us along the way pointing-out historic sites and landscapes. He also explained for 10 minutes what the buttons over our heads were for (lights, emergency....) and to go over and see him if the air conditionning was too cool, so he could heat it up, or if the air conditionning was too hot so he could cool it down. Go see him if the the music was too loud so he could turn it down or if the music was too soft so he could turn it up. And if ... Went for a guided walk of different art-deco buildings in the City. Long story short, in 1931 a 7.9 earhquake (on the Richter scale) (which is quite a big earthquake) and following fires destroyed a good part of the city. It was rebuilt with the 'in' architecture style of the moment: Art Deco. Since it was during the depression, the ornaments are not all that sophisticated (to me) but the city does have a special feel to it - and a definite unique touch: Maori patterns in the ornaments. Looked at maps for planning my next few days and pasage to the South Island. I'll likely bike to Opotiki from Gisborne (and fish the Waioeka) a few days. Take a bus to Rotorua (I've already biked half of the road to Rotorua on my way to the East Cape and there is something about biking the same road twice that bugs me) and do the Rotorua thing (Rotorua is a tourist must, rich with Maori culture - and fishing), bus down to Wellington, cross to Picton on the South Island (hopefully the seas wont be too rough...) and bike down to Christchurch. This itinerary would allow me to re-start my North Island tour in Taupo (late November), towards Taranaki, Waimoto, Te Awamutu (wonder why...) and (sadly) Auckland. I dont know what my tour of the South Island will look like after I make it to Christchurch. I will take a few days off with my cousin. I'll get him to brief me and work-out an itinerary - hein Bruno! By the way Bruno, I wont be able to make it for the 27th... maybe around Nov 1st. I tried but out-of-my-control events conspired to slow me down. And yes, Bonne fete Claudia! The song that I have giong in my cerebral juke box is a Steve Miller Band song, the one that goes ... 'I want to fly like an eagle' Time for some dinner. Cheers, Rene               "
3,"If ever in Napier, you have to check-out the Art-Deco (bien sur), but also go for a walk in 'The Bluffs'. Many nice houses, paths, parks, views. For the daring, dont do with a map ;) I had a map and by the time I made it out it was time to get back on the bus to Gisborne at 1:00 PM. If you bike the road from Napier to Gisborne, you are in for some serious hills, fascinating river gorges and narrow, winding roads. The mountains of NZ so far are mostly treeless - either clearcut or grazed by sheep and cattle. If there are trees chances are that the're a 'plantation' of the same kind of pine tree every time. Lots of erosion. Back in Gisborne I went grocery shopping for dinner and for whatever was missing for spending 2 days alone and if I did not catch dinner in the river. And if my bike is ready to go not too late tomorrow. Made my now famous (with myself) sauteed beef with veggies and pasta - but with cheese this time! Aint this exciting! I make me laugh. And red wine too - from Australia 2001 Shiraz, Jacobs creek. Red=Australia. White=NZ. not that Oz dont make good whites, but I have to give NZ wines a chance. Coming back from the supermarket, I had the bottle of wine on the outside of my daypack. A kid, maybe 13 years old came up to me and said something to me. I asked him what he had said. 'Keea-Oora!' with a not too distinguised tone of voice. 'Cheers' I replied. 'Is that wine for me or for you?' he said firmly. What the he.. are you talking about? I thought. Is this a threat? If there were 5 of you would you be taxing me? With nothing better to say I answered 'You wish?!' and walked my merry way away. If he had been 5 years older, that would have been a threat. After dinner had a good look at the waves on the beach. They roll a long time and form long white lines in the dark. Beauty. If no journal updates over the next few days, that means the bike is back and I'm gone fishin'. 'La Jasette' by Kevin Parent is today's song. Had it in mind while eating dinner. Cheers, Rene               "
4,"Around 12:30 Christine arrives, bikeless. Her first words were: 'Not good news'. I had to smile. The brake/shifter lever jammed - had to order a new one, will be in tomorrow. Now lets all sing the Gisborne Jinx! She told me she was getting a tune-up done as well. She is very nice through all this. Happens that her husband bikes quite a bit and their friend, Norm, runs a small bike shop for friends. I was planning on making it to Matawai, about 70 Km out of Gisborne, elevation 540 meters. That would have left some 10 Km uphill (to 725m) to the other side of the gorge for the next day. But instead I will re-pitch my tent in a familiar campground. Oh well. Christine offered to take me to Matawai tomorrow. If the offer still stands tomorrow I will take it. So wat did I do with my afternoon? Walked up and arounf Kaiti hill and all the Cook-related stuff (Cook made his first landing here). There is a statue to commemorate Cook, but it aint Cook. Ya gotta pretend its Cook. Funny. Bought some fresh Moki fish on my way back. Tonite is the Italy-Canada rugby game. Should be interesting, the All balcks beat the Italians with a similar score as the Canadians. Had some vegetarian chardonnay with supper along with the moki and garlic smoked mussels. Hope the legs did not lose too much strength over the 4-day break (Almost 5-day break). So If all goes well I'll have my flyline out tomorrow. Time to check the fishing equipment, make sure all is in order. Todays song, in honor of whoever is not Cook - Lets Pretend by the Northern Pikes.     "
5,"During the night I rolled to my belly/chest for a few seconds, trying to find a position to rest in for a few seconds. Something in my right ribs popped. It was sore from there on, nothing serious, but sore. Spent the day drinking salted and diluted orange juice. Chicken-noodle soup for dinner with bread. Hope that stays in. My chest realy hurts when I get up. This is a tough trip. Nothing stolen yet ... touch some wood. Rented a 'tourist flat' in the capground with a bed, shower, toilet... luxury! I may need to have the toilet nearby during the night... The Sun has set and I am very tired. Morale is low - hope it picks up as I recover from food poisoning. My bike is ready. Went to pick it up with Christine at Norm's place. He is passionate about bikes and I'm sure he did an excellent job. Merci! I am very tired. Song of the day? 'Anything is good for you' (if it doesn't kill you) by Crowded House."
6,"9:00 Christine picked me up in their pick-up truck and we were off to Matawai. She has been very kind. The radio played 'Thorn in my side' by Eurythmics. How appropriate... 'To run away from you was all that I could do'... thinking of Gisborne. Well there I was in Matawai with some 200 meters to climb - a reminder for the legs that the trip aint over. The climb was very painful. Not much food the 36 hours before, the poisoning, the ribs, the 5-day cycling break... but I made it. On the other side the scenery of the gorge is beautiful and spectacular. Stopped to fish 3 times, no luck but a rainbow trout did a salute (spectacular jump out of water) in the first hole. That was nice. The weather has been shifty but generally good. Hard to concentrate on the road with such a nice river next to it. I am seriously thinking about my priorities and waht I want to do with my trip. The delayt of almost one week and my guts remind me that I have to make decisions. I know I have to rest. Tomorrow Opotiki and Saturday Rotorua? We'll see. Big week-end - Labor Day on Monday.     "
7,"Ate 2 home made steak and cheese pies with ginger beer for lunch - my first real meal in 2 days! Okay, so to improve this trip, Item No 2:Make Christchurch a second start. Rest, rebuild the legs, and enjoy it. No3: This has to be fun. Narrow winding roads with trucks are not all that fun, no matter how beautiful the scenery. This may mean less biking - and no guilt if it is so (gotta remind me of that). We'll see. It is a beautiful day outside. I'll go and enjoy it (it is 3:20 pm). I also saw a doctor for my ribs. Likely soft tissue damage - not too serious. Good. Tomorrow the bus departs at 10:15 for Rotorua. Dire Straits 'Tunnel of Love' - I think thats the name of the song. Rene             "
8,"I did rest today and it felt good. I even dared having some ice cream. Yes! The weather is cloudy, windy and cold - good for resting.  Note: When the All Blacks score a try, the tune to play in the stadium is Something so Strong by Crowded House. Anxious to eat normally again. Appetite is back - thats good. There is a 'Grosse Pointe Blank' (the movie) ambiance in Opotiki this week-end - its the college reunion, 50 years. It was nice to see. Health is picking-up and so will the spirits. Its been a tough digestive/mental issue, especially with it coming right after I finally got may bike back after the accident. Thanx to family, friends and readers for support... and yes, I will enjoy the trip!
"
9,"It was quite strange to take the bus back to Whakatane and Ohope. I have already biked it and it was flooded then. Too bad we went by so fast, could have taken 'before' and 'after' pictures. There were wee sandbanks here and there in the fields following the flood. From Whakatane to Rotorua was a very nice road. Nice scenery (bush-covered hills, valleys, lakes...), good shoulder most of the way (with its narrow parts).  There was a big market in Rotorua where you could buy anything from couterfit CDs to circular sawbalde-clocks, soap and so on. thats where I thought of asking as a joke ' Where could I get a boomerang?' Never take a kiwi for an aussie. I dont think one would be very offended and take it as a joke, but still... Kinda like canadians and 'americans'. I have not yet slugged someone for sugesting I was a yank ;) Things are picking-up. I had my first real full meal in a few days tonite in a Chinese rice/noodle place. Just what I needed - with nice jasmine tea. Happiness is a cup of jasmine tea, friends and a healthy gut. Beauty. Spent the evening  wandering in the awsome gardens of Rotorua. Really, really unique and beautiful, with thermal vents scattered here and there, steaming pools - some a few square meters, some as big as an olympic pool. And bushes bloming, hot footbaths here and there. Beauty. Tomorrow I'll go fishing.  Quand l'appetit va tout va! Oh, and to finish the day, watched rugby on the telly with Andrew from Wales. We had a good time, good talk. Another chap from the English Isles on a honeymoon touring NZ in a van. He works with kids with all sorts of problems. A surfer, a carpenter, a Good man.     "
10,"The campground is quite small and cramped with vans, cabins, tents... today (the 27th) is Labor Day. HAd a good night sleep and for breakfast a ham and egg sandwich with a bowl of cafe au lait. And it all passed the gut test! yes! First coffee in almost a week - since the mussel incident. Hopefully I wont be whining and complaining about illnesses or mishaps in this journal for a while. Note: Canada will be playing its last rugby game of the World Cup Wednesday, which should still be tuesday back home, against Tonga. Should be a good one. Biked to Ngongotaha (10k)to fish late in the morning (usually not the best time...). There are small 2 streams that can be fished for a few 100 meters to their mouths in Lake Rotorua. The first stream had a few tires in it and a load of litter nearby, including an abandoned car. Not a pretty sight, but still, in a bend a little further down there were 2 dozen fish, stacked in the stream. Fished the hole with many different flies, nothing would make them move. I was about to move along when a man, maybe 50 with his son, maybe 12, showed-up. I let them have the hole and looked along... nothin'. The chap was Mike and his son Kyle. We had a good talk. He was from South Africa and by he told me he practically moved to NZ for the fishing! We traded flies, he gave me advice on where, when, how to fish the area - merci Mark! I checked-out other fishing holes, saw a few anglers and none caught a fish. Cooked me some dinner, hit the hot pools before sleep, beauty. Keep yer heads above water when in a hot mineral pool - or else ya might get amoebic meningitis. Sounds pretty nasty and serious and it is (something about an amoeba going through yer nose or ears and making its way to your brain...). Tuesday october 28th. Its raining cats n'dogs. Did not go fishing but enjojed the parks, the museum and orchid gardens. The vents in the parks are even more spooky in this weather. Tonite I go for the maori concert / hangi (feast) combo. A must do if yer budget aint too tight. A lot of outfits offer the combo. Some are likely better than others.  Tomorrow I head for Wellington, gateway for the South Island, a step further in this trip. I am a bit anxious to get back on my bike. The road from Picton (ferry terminal) to Christchurch aint the most exciting one, but it will be good to get back in shape. * The Hangi and concert were excellent. I ate lots and it all digested well. The performances were done with Mana - enthusiasm, pride and honor. Nothing tacky - well maybe the souvenirs but still very nice. I may just build a hangi oven back home. If you ever are in Rotorua and have the dineros, do it!       "
11,"The bus ride took almost all day, from 8:45 in the morning to 4:30 PM. The roads taken were roads that I had originally thought of taking, but plans are made to be changed. Between Turangi and Waiouru (south of Taupo) is a stretch of highway called Desert Highway, about 65 Km long. It is desolate, some good and winding hills and military training grounds on either side. It is not very inviting for a bicycle. I also saw a few 'cyclotouristes' on the road. I've seen maybe 4 couples or small groups so far, all since taking the bus. In Wellington I have an address, a friend of my brother's that I once sold corn with, about 15 years ago: Kirby (and Susan). Kirby and Susan live about 15 Km out of Wellington, to the North in Waiuiomata. I took the train to Lower Hutt, which is about 5 Km from Waiuiomata, just to avoid traffic and the motorway. The thing is between Lower Hutt and Waiuiomata, there is a pretty long and sometimes steep hill to climb. I wasn't prepared for that. I called Kirby, no answer. Destiny wants me to go over this hill by my own means - and I do need the exercise. Top off the water bottles and away we go. The climb was not too bad. Stopped a few times (reminded me of Te Motu hill) and this chap biked by me, going uphill, we exchanged short polite smiles. The hill is also a 6-lane road, lots of fumes from the cars and trucks - tough on the lungs. Not much of a shoulder. Glad I have my orange vest. Kirby had warned me of the hill in a previous e-mail, but I had forgotten about it... Did make it to the top and the chap that had passed me was there taking a breather. We had a chat and he told me to give him a call if my plans for accomodation did not work out (I still had not yet spoken to Kirby). Made it to my home for the night, greeted by Susan and Kirby, had a nice evening talking science, travelling, food poisoning... really nice.  Thursday morning Kirby brewed some coffee, showed me around the garden, the trees and took me for a tour of town. Actually, I'm a bit tired so I'll log this some other time. Some other time starts here: Yes, Kirby gave me a tour of Wellington, including Victoria Hill (is that the name?, I dont have my map in the Internet joint at the moment). Anyway, its THE place to have a look at Wellington from above. A great tour, merci Kirby. Got to see where all the faults pass through Wellington (including where the main motorway, the train lines, the water mains all follow the Wellington Fault (!), the Wellington airport with water at both ends and hills on either side - apparently the 2 things pilots dislike the most in an airport). Yes, Wellngton is a special place to live! Susan works in geophysics, so its appropriate for her! In the afternoon I visited the new NZ National Museum. It is huge, many exhibition halls, and free. I spent a good 3 hours wandering here and there. I tired to have a look in each hall, but I'm pretty sure I missed a few. Not only is it big, but its like an Ikea store - mazelike. I wanted to taste paua, a local shellfish, but its kinda rare so I had a paua fritter in a fish n' chip joint. I was served this four-inch wide, half-inch thick round, dark brown, heavy puck. Awful. Must be better paua out there somewhere. Tomorrow is Halloween. Halloween is not very big here - no trick or trating or decorations on houses but Susan and Kirby are throwing a Halloween party tomorrow. I am welcome to stay, but if the weather is nice, the call of the chamois will be hard to resist. Last but not least, I watched Canada win their rugby match against Tonga, 24-10 or something like that. The team captain, Al Charron, 37, the team veteran, back from serious knee injury a few months ago to make it for the World Cup was playing his last career game. And just like in the movies, halfway into the second half he got nailed. A clean hit. A hard hit. He was out cold lying on his back, still, blood trickling out of his mouth. The play stopped, got him out on a stretcher. The next day I typed 'Al charron rugby injury' into Google. He was fine.     "
12,"Once in Picton we all went our merry ways, Angelika and Phil left quickly for Ward (75 K), which is in the same direction, but farther than my destination: Blenheim (30K) for wine-tasting. I had a bite to eat before the ride. There was a beautiful tailwind, blue skies, comfortable weather, nice road with no serious hills. It was great to be back on the road. And I forgot my orange vest in Wellington. Note to self: Will have to get a vest in Christchurch. When I made it to Blenheim, I saw Angelika and Phil getting ready to head out after a breather. I stopped to see them, pondered... beautiful riding conditions with nice folks or wine tasting? Hmmmm... The riding won.  We rode at a leisurely pace, enjoying the tailwind and the beautiful weather. One of the best moments was approaching the top of a hill where the road passed in a trench. The view across the trench was awsome, a window on snow-capped mountains with dark, multi-textured clouds at their top. It was unreal. Made it to Ward, shared a bottle of wine and enjoyed the evening. Tomorrow's forecast calls for nice weather and northerly winds = tailwind. Beauty. We should make it to Kaikoura tomorrow... swim with dolphins? Have a crayfish (langouste)dinner? Could be a nice and expensive stay. Ya only live once. Half moon in the sky with tapestry of stars. Cant help but hum 'Moonlight Desires' by Gowan.           "
13,"What a beautiful day. Woke-up to a tough nights sleep. My ribs really hurt when I run or lay dow to rest, or move lying down - but it was a great day. HAd my daily Cafe au Lait in a tea room accross the campground with some bacon and egg pie and an apple turnover. Angelika and Phil joined me while I was talking with a farmer: Crops, sheep, subsidies, vines vs sheep... excelent. * Its noon, Gotta go see the dolphins! Well the dolphins got cancelled - the sea is too rough. So Angelika, Phil and I went for some lunch on the main in Kaikoura. Nice tempura calamari with a pint. Well wadda ya do when its beautiful outside and you have time to kill? (I chose to stay in Kaikoura till tomorrow to see if there could be a chance to swim with the dolphins tomorrow morning). Well ya ride yer bike around and Kaikoura is a good place to do just that. Wait a minute I'm logging day 33, not day 32! Yeah, day 32 now. Ward to Kaikoura. What a marvelous day. Hills to the right, ocean to the left, playing leapfrog with the rail line, tailwind, all kinds of flowers blooming and their scents filling the air. We stopped often for tea or to enjoy the sights or fix a flat tire (Phil - a ling rusty nail) and a broken rear derailleur cable. Actually we did not have a spare cable for the derailleur. Rumors had it that my jinx was contageous. The broken cable was on Angelika's bike. We blocked the derailleur in a middle speed and Angelika had a 3-speed bike with 40 Km to Kaikoura. Phil and I took turns at leading (the wind was now shifty) to give Angelika a break. Now that I think of it Angelika got attacked by magpies yesterday. Twice. One swooped down and the other dived twice onto her. Combine this to the flat tire and the broken deraileur cable - yeah, it does look like I am bad news! :)  The most spectacular stops were near Kaikoura where cliffs and rocky outcrops emerged from the sea, with heaps of seals sun bathing here and there. Some seemed to be fighting, fencing with their heads, others were swimming nearby in tidal pools. We spent quite some time just looking - as were 2 seal field workers, next to us. We also stopped so I could get a koura (crayfish / spiny lobster / langouste) in a roadside stand. I could already taste it, with a nice cold brew. All together now... all you need is beer, beer, beer is all you need... The koura was good, but not omigodthisisgood! good. Had it, one item checked off the to-do list. Nice dinner. Angelika, Phil and I got to know each other better. Thats nice. Kaikoura reminds me of a village back home: Tadoussac. Not a big place, lots of hostels, campgrounds, whale-watching and other sea-related activities on the menu. Tomorrow I may try to go swimming with dolphins... Cheers, rene         "
14,"After my morning cafe au lait, I headed back to the campground for extra sleep. Short sleep and wandered over to Angelika and Phil's caravan (not the best they had so far on their trip... the manager of the campground told Angelika and Phil 'Come with me and I'll show it to you - I want you to see it before paying for it'. Angelika was there and Phil arrived seconds after with 3 cups of coffee, one was for me :) Their whale watching trip was cut short cos the seas were a bit rough and clients were starting to change colors. Since no whales were sighted, the company offered a 90% discount for a second whale excursion tomorrow. Angelika and Phil will take it - and change campgrounds. I spent the rest of the morning in town, waiting for the dolphin swim, which Angelka and Phil also signed-up for. The swim was finally cancelled due to rough seas. As written yesterday, we had some lunch and I headed for the Kaikoura Peninsula. The Kaikoura peninsula is a very noce bike ride. At the end, there are walks, a seal colony and at low tide, a great rock shore to explore. Many sculpins, crabs, shrimp and shellfish in the tidal pools. Lots of good looking people too. Its a beautiful day. If you go to Kaikoura, explore around - its worth it. For supper I made myself a picnic by a beach, very windy but very enjoyable, overlooking the bay with sunset at my back. I had a huge hazelnut chocolate bar and devoured most of it. I suspect that all the nice people ;) I've been seeing lately are the cause of the chocolate feast. Finished the day by visiting Angelika and Phil who slept a fair part of the afternoon in their new accomodation. Watched rugby on the telly and shared green tea. They will be up early tomorrow to go whale watching and I will try to go see the dolphins, but not the 5:30 excursion, but the 8:30 one. Cheers, Rene       "
