,blog
87,"Filed by Dan Tues., April 138 pm Texas has always been looming out there, so large that it will probably take more than 2 weeks to get through it.  Leaving Las Cruces, on route 28, our first stop was the post office in Mesilla, where my third round of mailing stuff home took place.  I always over-pack when I  travel, but in these circumstances, it really makes a difference.  We then cycled through beautiful countryside, laced with pecan groves and onion fields.  Next came the beginning of horse country, with several large thoroughbred farms along the way.  For the first time in a while, I actually had to pay attention to the map, because unlike most of our route thus far, today's route had several turns along the way.         Approaching El Paso, we paralleled the Mexican border for several miles along the Rio Grande.  It isn't the mighty river here that I have in my mind's eye, but its symbolism is powerful.  Entering El Paso, there were long lines of trucks waiting to get over the border with their wares - NAFTA at work.       There's something about immigration here I've never understood.  People come across the border illegally, enduring the most horrible of conditions through rat invested tunnels, in sweltering locked truck trailers, or just braving the cover of darkness with a coyote to whom they've paid a family's fortune.  Yet busloads of Mexicans come over the border legally as day workers, and even to go to casinos for entertainment (if you can call it that).  What is keeping these people from just disappearing into the fabric here, and why would anyone risk so much choosing to come in illegally instead?  The only thing I can think of is that coming in illegally, there would be no record, whereas coming in legally and walking away, you would risk the authorities trying to find you.  But does INS really have the resources to hunt individuals down?  If anyone with a better understanding can shed some light, I would be grateful. I found El Paso to be a pleasant surprise.  Almost no one I spoke with, nor journals I read, had a good thing to say about this city.  But I found the international flavor to be exciting, the markets bustling, and the people friendly.  I know there are bad parts, be we somehow managed to avoid them.  We continued along the border on Delta Drive, which passes the Chamizal National Memorial.  Over the years, the Rio Grande has made several course changes - and without asking permission.  So logical a natural border the river is, if it moved, so did the border.  Many disputes erupted over the years, the most famous being in 1851, when a large course shift in Texas' favor created a large wedge of land called El Chamizal.  The countries bickered over this border change for 60 years before the territory was awarded through arbitration to Mexico.  The US, however, rejected the decision (I guess acting unilaterally again), and held on until 1963 when a review board awarded 436 acres of the area to Mexico, and 193 to Texas.  More than 3000 Americans woke up to find they now lived in Mexico, and had to be relocated. Tomorrow we head off into the vast emptiness of Western Texas.     Tuesday April 13, 2004 El Paso, Texas Filed by John John Stark As we approached El Paso on highway 58, off to our right was a fence with barbed wire on top.  Then as I looked more I realized the Rio Grande was just beyond that then Mexico. It looked like a third world country, poor.  A couple of Mexicans shouted something to us and waved and I waved back.  Along the way we encountered several Border Patrol vehicles, just sitting there watching. It looked like a fairly easy border crossing and the Border Patrol can't catch them all.  When my family and I were in Florida this spring I was informed that smuggling aliens was much more profitable with less risk, than smuggling drugs. Moore asked what do we eat?  If we are in a restaurant I will order some cheap filling breakfast, usually pancakes.  Sometimes the hotel will provide a continental breakfast.  Such was the case in Las Cruces this morning; I had cold cereal, several tiny muffins with jam, toast with some sort of gravy, 5 or 6 cups of juice and lots of coffee.  We didn't eat again until about 2;30 PM, when we stopped at McDonalds.  I had a double cheeseburger $1, chicken sandwich $1, 2 apple pies $1, senior coffee $.27.  My wife Cher describes me as a right hand menu guy.  Usually at the bottom right corner will be a grilled cheese sandwich for about$.89, and I will proclaim I'm not very hungry and order the grilled cheese.  On our first date I said I wasn't very hungry and why didn't we split an order, of course dutch treat.  Cher has mentioned many times that I then proceeded to eat the entire meal.  There is a reasonable explanation for this, too lengthy to go into here.  Some members of my family have described me as cheap; I prefer the more descriptive, frugal.   In the evening I will have a hamburger and several candy bars, striving to keep a proper balance of the food groups.  This evening I even ate some of the lettuce that came with hamburger.  What amazes me is that riding for 6 hours or better a day, good nutrition and my weight doesn't seem to be going down. We have gone about 840 miles and are looking at 1,000 or so miles through Texas.  At this point I want to go in the straightest possible line, in the least amount of time to Florida.  I miss my family and my butt is sore.  Fortunately the weather has been quite nice.  It has been demonstrated to me that we aren't prepared to ride in extreme weather, to dangerous.      "
88,"Filed by John Wednesday April 14, 2004 Fort Thomas, Texas John Stark Slow day getting started from El Paso this morning.  There are a million ways to prolong getting on our bikes in the morning, and today we used several of them.  We walked a mile back to go to Wal-Mart so I could get a camera and Dan wanted an air pump. Success on the camera but nix on the pump.  Fortunately there was a McDonalds on the way back to the motel, I limited myself to 2 sausage egg Mac muffins.  After mounting our bikes, 4 miles east of the motel was another Wal-Mart where Dan got a pump and I a book.  Having exhausted all stalling options we finally started out.        We managed to go a little over 50 miles, and praise the lord it was flat.  Some wind but over the last 40 miles we probably averaged a little over 17 mph.  At a break Dan let me know that tomorrow held some bad news, actually it was much worse than I could have imagined, the dreaded time change.  Even though the time change won't come until we have been riding an hour or so tomorrow, I bit the bullet and changed my watch tonight.   Motels are few and far in between in western Texas. I have become a hardcore negotiator in trying to get rates down.  First I try military, AARP, government, US Boats, AAA, and then I get tough.  I explain we are on a mission of mercy raising money for Habitat for Humanity.  With my voice cracking and tears trickling down my cheeks I pull out the Addison Independent article telling about our trip.  Usually I am dealing with the only motel within 30 miles, these innkeepers wouldn't give their homeless mother a discount.  Today after I had gone thru my shtick, the innkeeper looked at me with beady eyes and said $45 tax not included.  But I protested we never pay over $40 tax included.  We got a beautiful room 2 sinks for only $45 tax not included, grrr.   Tomorrow we are on to Van Horn I-10, which is 58.9 miles by my gps, which only measures straight lines.  I-10 is a little shorter and the hills will be more gradual.       Filed by Dan April 14 10 pm Since it's late and we're getting an early start, I'm off to bed.  Tomorrow beckons.     "
89,"Filed by John Thursday April 15, 2004 Van Horn, Texas John Stark Had 3 flats on the way to Van Horn today.  Just as I had finished changing the last one, along came a pick-up coming from the east on this gravel access road that I had pulled off I-10 to change my tire. It turned out to be a federal fireman from White Sands Missile Base, by the name of Steve Tuckness.  Let me tell you a little about Steve: he had turned around and come back to see if I needed any help.  He persuaded me to accept a ride with him past the construction on I-10.  He turned put to be such a likable cheerful guy I stayed in the car to Van Horn, about 15-20 miles.  I should mention that once the construction was done I didn't suggest he let me out, oh no.  It seems that Steve likes his job, likes his life, and even sees his ex-wife who divorced him because he woke up happy every day.  Think about that for a minute.  My wife Cher says that people like Steve are angels who are put in our path at certain times.  Steve dropped me off at McDonalds and insisted that he buy me a coffee.  While we were there everybody who came in and out of McDonalds he greeted and hoped they would have a grand day.  My day after meeting Steve did a 180-degree turn.  The resentments and irritation at having all these flats and bad luck, just disappeared, poof gone. I'm firmly convinced that god put Steve in my path just when I needed him.          Dan and I agreed on a route to Del Rios and then up to San Antonio.  The more direct route along I-10 saved 80 miles.  The alternate route will allow us to visit San Antonio and stay at Fort Sam Houston, a famous Army base.  Neither of these had been on regular schedule.  We had been scratching about this for a couple of days.  It was meeting Steve and having an attitude readjustment that enabled me to seek a compromise route that suits both of us.  Best of all it is relatively flat, with no day over 90 miles. Filed by Dan Thurs. April 159 pm It was great to get an early start.  I think I had ridden 50 miles today by the time we started out the day before.  We rode along I-10, which for the most part had a wide concrete shoulder that made for speedy riding.  Traffic was a little heavy at times, but was more than offset by the zoom factor.  At one point I was racing a freight train and nearly keeping up.  The fact that I was going as fast as I could, and the train was going slow didn't diminish the return to childhood memories of racing cars on my bike.  Along the way were friendly horn beeps from truckers, and waves and thumbs up signs from construction workers.  We'll be leaving the Interstate tomorrow in favor of a route that gives an approach to San Antonio that sallows us to sidesteps the hill country of Texas.       I stopped at the incredibly helpful Chamber of Commerce in Van Horn to get some route information.  Anyone coming through these parts would do well stopping in.  One of our biggest dilemmas has been choosing a route with motels within a reachable distance, factoring in mileage, wind, weather, and hills.  In fact, our route tomorrow spans 74 miles without a single legitimate town, so we'll have to carry extra food and water.  Within a few days, we shouldn't have to worry about such things as we will be getting into more inhabited country for the rest of the trip.    I finally solved the veggie dilemma.  My concerns weren't helped by an article in the El Paso newspaper about the high incidence of foodborne illness in lettuce, and other vegetables.  I finally bought some canned spinach and a can opener, stuck it in a microwave, and was in macrobiotic heaven.  While hardly gourmet, it tasted great."
90,"Filed by John Friday April 16, 2004 Marfa, Texas John Stark Today was a tough day; we made about 75 miles in 6 1/2 hours, riding 5 of those hours.  I drafted behind Dan the entire day, which made me go faster than my ordinary pace.  We took only 2 breaks, where we got off the bikes, once in Valentine at 38 miles, and 16 miles later halfway to Marfa.  Now I had several stops to pee but I never leave the bike.  Since I have my new digital camera I stand there astraddle the bike getting rid of the morning's coffee.  Passing traffic think I am getting shots of the scenery.  I probably make 6 of these stops in the first 20 miles.  After drinking 4-6 cups of coffee in the morning, it seems I have to make frequent stops.  I don't think it's the coffee; it's probably excess water, so from now I will limit my water intake.    In the town of Valentine where we took our first break, the only building in town that was open was the Post Office.  We were able to get water behind the Post Office from a well.  We took our break at a closed gas station; there was a closed restaurant just up the street. West Texas seems to be a hard place to make a living.  Towns look like ghost towns, with what is there being poor.   This area of the country is flat and sparsely populated.  We climbed most of the day until we were above 4900 feet.  Just imagine this is higher than Mt. Mansfield, and goes on as far as we could see.  For miles we stayed at this level. Of course with a wind in our face, er, in Dan's face, I was tucked in behind.   When we pulled into town I stopped at the first motel and did my usual hardnosed bargaining.  Of course she didn't budge an inch even though the lot was empty.  There were 2 other motels at the second the clerk informed me that because of a motorcycle rally there weren't any rooms for about 50 miles.  Tail between my legs I returned to the Capri Motel.  Unfortunately the empty motel had just rented their last room, my room.  Luckily we went across the street to see about renting an apartment for one night.  No luck, but as we were leaving the motel lady came running out and said she had a cancellation.  We were considering asking the churches if we could sleep on their pews, which would have fit nicely in my price range. Filed by Dan Fri. April 169 pm I get a little apprehensive on these long desolate crossings.  Six hours riding without anywhere to get food and water (we later unexpectedly found water at a small post office) is a little daunting.  But we had just enough traffic and friendly waves to feel that we'd be well taken care of if we ran into any problems.  The empty areas of California, Arizona, and New Mexico had a lawless feel to it - like a haven for crazies wanting to escape civilization.  No so much here.   Speaking of crazies, any readers thinking of doing this trip may want to consider Route 90 from Van Horn, due to the flat terrain, and shorter distance.  The riding surface was great, with a wide shoulder the whole way. At first the town of Marfa had the same ""town stuck in time"" feel to it.  But to my pleasant surprise, it seems to be making a comeback.  There were several art galleries, a great bookstore with FREE high speed internet, and two restaurants where we could have spent John's food budget for an entire week.  The town benefits from being a jumping off point for Big Bend National Park, The Davis Mountains, and the McDonald Observatory.  The classic film, Giant, starring James Dean, Rock Hudson, and Elizabeth Taylor was made here, and the cast and crew were housed at the beautiful, historic Hotel Paisano during filming.  Much memorabilia is displayed in the lobby.  Across the street is the old Opera House, now used as an office space.  When it was built in the early 1900's for $4500, it was the only venue for silent movies between El Paso, and San Antonio - a distance of more than 500 miles.  And to think I complain about having to go to Burlington for the movies.      I used the iPod for the first time, and it was awesome - perfect for this long day.  On today's program was:  Crosby, Stills, Nash and Young - 4 Way Street (the electric side) and Elvis Costello - My Aim is True. Since lodging was so tight due to the weekend Motorcycle Rally, I called ahead to our next stop and got one of the last two rooms in town for Sat. night.  Unfortunately, there aren't phones in the room, so there probably won't be an update tomorrow."
91,"File by John Saturday April 17, 2004 Marathon, Texas John Stark Moore was right when he said beware of people who say it is all downhill, yeah and let me sell you something.  There was a slight uphill to Alpine after 22 miles or so we were told.  We actually managed to hit 5100 feet of elevation.  The next leg to Marathon about 35 miles was very gradual for a while and then, dare I say it, downhill.  In fact it was uphill most of the way with a brutal wind blowing in our face.  The wind was so strong it was difficult to go downhill, when there was downhill.   It is getting to the point where I am able to ignore my sore butt, enflamed nipples, numb sore foot, hip, and mind cramps.  Going 22 to 35 miles without a break is becoming routine.  Pee stops aren't considered resting because I never actually get off the bike.  There are a couple of explanations for these factors; one is that I am getting in great shape mentally and physically, or the second, which I lean toward, is that my entire body is seized by a giant cramp and my mind leaves my body, to reassemble in the evening.  So far I've been lucky and have managed to reconnect, but what if it don't happen?  As you can see this trip has sparked some profound and vigorous brain action.     Tomorrow is again 55-60 miles, of course downhill.  The next day is about 90 miles, guaranteed downhill.  I am sitting outside my motel room with a strong east wind blowing my face; east is the way we wander.  Filed by Dan Sat. April 174 pm For the second day in a row, a had a flat before even leaving the motel.  Better there than on the road.  I had underestimated today's distance by 9 miles, which coupled with swirling winds made things challenging at times.  Our first and only stop was in Alpine, which is a very nice little town.  We saw a lot of motorcycles from the rally, and hung out for a couple of hours.  I needed to refresh my tube supply, so I called the only bike shop in town.  It closed at noon, so we hurried over and met John Elbury, the owner.  Hours vary, so if you're coming through, call ahead.  He has a very nice little shop that can handle most repairs and flat tire issues.  And if you're having sanity issues, he's also a clinician in the mental health field.  During the grey months of winter, bike shop business slows down, but he does a brisk business counseling people.  In the sunny months, the reverse is true.  He was an all around good guy.     On we went to Marathon, and our waiting room at the Marathon Motel and RV Park.  It is a very cool little place with a nice restaurant, an outdoor fire pit and gathering area where tonight they have live guitar music, and a few rustic cabins.  Our room is so small that it can barely fit the small bed and roll away, let alone our bikes.  But it has everything we need, and a beautiful setting to boot. The town, while very small, is very sophisticated.  There are several galleries, a bookstore, restaurants with interesting menus for a change, and a bakery/coffee shop with internet, which is where I am filing this from since our room has no phone.  I can't put my finger on it, but this place has a very content feel.  For dinner we had some great Texas BBQ at a local restaurant.  Later, I was sitting in the lobby of the Gage Hotel thumbing through a book of photographs by local photographer, James Evans, when I came across one of Judy, The Burro Lady.  She was the subject of pictures John and I took.  She's well known around these parts, and just drifts about crossing these long expanses on her burro.  The photographer had on several occasions asked permission to photograph her, and she had always refused.  But one time she agreed.  He later showed her two 11"" x 14"" images he had taken of her, which she said were ""nice"".  He tried to give them to her, but she refused.  Initially he was hurt, but then realized, what would she do with them?       Somehow we've managed to ride over 300 miles in Texas and have yet to see an armadillo or an oil rig, although I did see a tarantula.  But we still have 400 miles to go.     "
92,"Filed by John Sunday April 18, 2004 Sanderson, Texas Today was supposed to be downhill all the way from Marathon to Sanderson, and it was after about 30 miles of uphill.  It was about 55 miles point to point with nothing in between.  The wind was in our faces the entire way, so even when we did hit the elusive downhill, it was like we were pedaling uphill.  The countryside is spectacularly beautiful, with wild flowers everywhere.  Everything is green, a birder's paradise with the little critters chirping along the way.  West Texas has already received its annual rainfall.  We were told at a restaurant that this is the best and greenest it has been in 15 years.  Makes you wonder what it is like in a usual year.  Apparently brown is the normal landscape coloration. West Texas is about the size of Wisconsin and there are only 55,000 people in this vast area.  The Spanish have a word for the area, which escapes me, but means desolate, deserted.  We were told that in Alpine one could buy a section of land, one square mile (360 acres) for $8,000.  Just south of Alpine one can buy 5 acres for $450.  In Sanderson where we are bedding down, people just left their houses and moved away.  In the 55-mile stretch I could count the number of buildings on one hand.  We are traveling Route 90, sort of a secondary road where the speed limit is 75.  Coming into Sanderson, the sign read, 'reduce speed to 65'.        The West Texas people have been a kindly diverse crew, going out of their way to help us.  This afternoon, Mildred Barber, horsewoman, carriage driver from all over, but 'born and raised in Texas,' held court at our table throughout our entire meal.  Advised us where to stay and eat, and when told that we have to go 90 miles tomorrow before a motel, she went out to her truck and tried to give us a tent.  Who would have thunk it?  Oh and she runs the only liquor store in town.   Tomorrow we are going 90 miles before the next motel, in Comstock just outside of Del Rio.  There might be one store, in Langtry, about 60 miles outside Sanderson.  But it's all downhill. Last night at the Gage hotel in hotel in Sanderson I heard a very interesting singer, Craig Carter.  Of course western. Filed by Dan Sunday April 188 pm We went to bed last night with a howling east wind, but in the middle of the night, it stopped like someone closed the window.  So we got on the road early to try to beat it.  In the past several days, it didn't really come up strong until afternoon.  Riding through a mystical fog, the landscape takes on an entirely different character in this different light.  I got in a groove riding so I didn't really stop much along the way, arriving in Sanderson before noon.  It gets hard emotionally seeing these depressed towns and the hard lives people live.  Through it all, they are among the most genuinely friendly people I've met anywhere.     Yesterday, we exceeded 30,000 feet climbing - more than the equivalent of climbing from sea level to the top of Mount Everest.  Happily, it's all downhill from here again.  The last few days, we've been turning up in the same town as a British rider, Dave Telling.  He has done a number of these rides including the Outback of Australia (he assures us that is really remote) and all over Europe.  He goes at his own pace, stopping to bird-watch along the way, and camping when he feels like quitting for the day.  Tonight, he's living in luxury at the next door motel.  I paid him a visit to chat and he insisted on making a donation to Habitat.  He asked me to send his love to his family.  Tomorrow, we'll probably separate for good, leaving us with memories of his good cheer and conversation.   Tomorrow, we likely have our last day in the sparse West Texas countryside.  It will be a long 90 mile ride, and we'll leave early to again try to beat the wind.  Once we hit Del Rio on Tuesday, towns and civilization return.  At the moment I'm looking forward to the change, but I bet there will be days in the future when I'll think longingly of this area.   Most likely, we won't have internet access in Comstock, but we'll update as soon as we can."
