,blog
36,"The next Medical Centre after Wanaka, up the West Coast, is at Hokitika or Greymouth which is, would you believe it, about 450-500kms away. We could stay here until Friday or Monday and see the doctor again (and even then he might not take the stitches out) but as much as we like Wanaka we are limited as to what we can do with Jo not being able to manage much more than level walking at the moment. The other variable is that there is some bad weather due tonight and into tomorrow and then it is supposed to turn back into something like 'summer' from late Weds onwards. So we have devised and implemented a master plan, which is............... 1) We are booked into another backpackers nearby for Tuesday night as the one we are in is fully booked. 2) We sit out the bad weather here through Tuesday  3} Jo is booked on a bus on Weds to take her to Franz Josef Glacier (about 280kms away) and is also booked into the Youth Hostel there for 2 nights. 4) I cycle to Franz Josef through Weds & Thurs and possibly into Friday as well depending on my legs and the wind direction. The scenery over to the West Coast and up to Franz Josef is superb even more so if the weather forecast turns out to be correct (you got to have hope). So Jo gets to see it from the bus and I see it somewhat slower 5) We are both booked into the Youth Hostel for Friday & Saturday. Franz Josef will provide a change of scenery and there are some short walks we could probably do there. 6) We then both catch the bus to Greymouth on Sunday and get to see a doctor first thing on Monday morning and hopefully by then get rid of these blasted stitches and get this tour back to something like normality. We shall see by next Monday whether this best laid plan comes to fruition or not. The way things have been going lately though something is bound to crop up to put a spanner in the works. Tuesday 24th Feb - bad weather, what bad weather? We have stopped believing these weather forecasts; the bad wet weather they forecast came through during the night and the only 'bad weather' we got today was the very strong winds, which would have made cycling very difficult in our planned direction so it was a good job I wasn't setting off today. After a cool start it was a nice sunny day but very bracing with the wind whipping up off the lake for our walk of 2hrs+ that we did along the lake shore - flat, so Jo had no problems. Jo also managed to ride her bike today. That shocked you didn't it so perhaps I had better elaborate - she got on her bike (without too much difficulty) and free wheeled the 200 metres down the hill to the other backpackers place we were booked into; not a pedal was turned. We had a real neat bedroom at the Matterhorn South Backpackers; it was a shed in the garden, but this was no ordinary shed - timber lined walls, carpeted, a double bed (that just fitted in), a little built-in wardrobe and storage shelves, a sink with hot water, electric lights and a heater. We loved it; it had been called (lovingly) 'The Hobbitt Hole' by some previous guests.........$50 and it's yours for the night and with very good  facilities in the main building as well, which was all of 3 strides away.    "
37,"       Where else can you start from a beautiful location like Wanaka then ride on the left hand side of one lovely large lake (Lake Hawea) backed with majestic mountains then cross over a smal col and travel on the right hand side of another lovely large lake (Lake Wanaka) backed by even more majestic mountains(snow capped); then head up a broad mountain valley (Makarora) with more snow capped mountains; enter forrested areas (The Mt Aspiring National Park); cross over the main divide of the South Island(Haast Pass at 564 metres) and then drop down to rain forest, wide glacial rivers, waterfalls everywhere and with even higher mountains (with glaciers and even more snow) as a backdrop and then finish by the remote and desolate West Coast.           Words are not strong enough; awesome comes nowhere close and even pictures only tell half the story. All cyclists coming to NZ must not miss out of this route - it's numero uno! Take your time and do it in 2 days with a stop at Makarora, about halfway. I was on a mission so couldn't afford that luxury. Today I saw 10 cycle tourists going in one direction or the other and about another 15 in two separate supported rides and then there were another 5 (2 Canadians, 2 Brits and 1 Austrian) at Haast who had ridden from Makarora  today. The 2 Brits had even sat in Wanaka for nearly a week waiting for good weather to ride it in.  We first did this route in 1999 on an even better day than today (no headwind). Even second time around it's quality has not diminished one iota. I've nothing more to say on the matter otherwise I'll just rabbit on and on about the route. Some other news: The Austrian lad was having some real problems with his rear wheel; broken spokes and then when replaced we couldn't true the wheel up properly because of seized nipples. For answer to this problem see tomorrow's entry. How to recycle a wheel: The Canadians had acquired a front wheel today, couresty of a car driver who had found it; the rim was ruined. However some of the spokes were used to help the Austrian; some other good spokes and the hub were kept by the Canadians. They had no use for the tyre or inner tube (wrong size for them) so they were passed to me. Everybody wins! Jo's story:- The bus trip was an uneventful 5.5hr journey and along with me there were 5 other cyclists, some going to Fox Glacier and the rest to Franz Josef. I had a genuine reason not to be cycling but they were missing out on some of the best cycling on the South Island. Sure it's a hilly route but I've ridden it before and I am in my fifties; why weren't they riding in geat weather like this? We passed Dave alongside Lake Hawea and I got a wave from him. The Youth Hostel at Franz Josef was a lovely place and I got chatting to quite a few interesting people; the time flew by. I got lots of assistance travelling on my own; a young lad getting my bike off the bus and putting the wheel in; a young man at the hostel reception taking my bike round to the bike shed and then carrying my bags to the dormitory; I was standing at the patio entrance wondering which table to sit at and a young man offered to put one of the umbrella's up for me. This is all fantastic but what concerns me is that I don't know if it is because of my injured knee and they have sympathy for me or that they all might be missing their mothers. I think it's a motherly thing because I was allocated by misake a bed in a 4 bed dormitory for the first night and I was sharing it with 3 young lads. The French lad at reception had mistaken the booking as it was made out for Jose, my full name. Anyway, the lads were all as good as gold and looked after me and kept the room very tidy and went to bed without any fuss! I moved to a female dorm the next morning.
"
38,"     A total change scenically from yesterday (weatherwise just as good) and nearly as enjoyable; it was coastline, rain forest, mountains on my right hand side all the way and just a glimpse of snow on the tops from time to time - I don't need glasses to look at the scenery! Only a few steep hills and they came in the first 30kms which was a good job as I had some aching legs today after yesterday's ride so was glad of some gentle riding. The answer to the Austrian's wheel problem was: He disabled the rear brake so the wheel would run without catching; he phones the bike shop in Hokitika (250kms away) but they couldn't provide a a 700c wheel so he finishes up phoning Christchurch (about 500+kms away) and they could. He rides 123kms to Fox Glacier with a front brake only; said it was 'fun' going down the few steep hills - the new wheel is scheduled to arrive at Fox Glacier by bus tomrrow afternoon. Problem sorted!        I phoned the Franz Josef Youth Hostel and left a message to tell Jo that I will be there tomorrow morning for coffee at 11:00hrs - but I didn't tell her about the glasses. In the evening I walked into town to get something for tea; went into the small supermarket but nothing took my fancy so I wandered into the pub (as you do without thinking sometimes) and thought I may get something in there. It was very busy so I had a beer to wait a bit; it was still busy 15mins later so I had another one. Now I had just about spent my dinner budget so I went back into the supermarket bought a yoghurt, a banana and a packet of crisps and went back to the campsite kitchen and ate it all with the last of my bread and cheese and chatted with the others; far more enjoyable than spending mega bucks on a pub meal. Do you think all of that is good fuel for tomorrow though ? - I am not so sure.   "
39,"   Said my goodbyes to the others and I was off just after 09:30hrs for the 25kms to Franz Josef where I had an appointment with a certain lady for coffee at 11:00hrs. Some nice easy recovery cycling I had thought but I had forgotten how hilly this section is - straight from Fox it climbs to get over Cook Saddle then it descends before climbing again to get over Omoeroa Saddle, both longish climbs - this was no easy recovery ride! Especially so as I had to push on in the last 5kms to try and get there for 11:00hrs; I failed by 2 mins and I have to say I was a bit lathered when I arrived - I hate being late for appointments;  it's just shows a certain lack of respect don't you think. The rest of the day was Jo telling me all that had been going on and me trying to keep alert and show an interest; I don't think I impressed her but then I don't think she fully realises that I am a tad tired after the past 3 days. It's definitely far easier for me being in a twosome cycle touring setup as it stops me from thrashing myself silly.  The good news: There is no doctor in Franz Josef (however one visits every monday if you are prepared to wait untl then) but there is a district nurse so Jo went off there just to see about getting the dressing changed and came back with the stitches out and a new dressing. I hope she doesn't want to go cyclng tomorrow; I may need some more rest. I was laid down this afternoon trying to do just that and the fire alarm went off so we all had troop outside; it was a false alarm. Jo going to the nurse and getting her stitches out unexpectedly has thrown the Tour Leader's plans into disarray. Previously we had a booked a bus on Sunday to take us to Greymouth and also booked some accommodation there; Greymouth was where we initially intended getting the stitches out. After a brief committee meeting we have decided to stick with these travel plans and start our cycling again from Greymouth.  Question: Do you know what the problem is with having fine weather at Fox & Franz Josef Glaciers? Answer: It's the constant noise from dawn to dusk of helicopters and light aircraft flying with tourists to and from Mt Cook & the glaciers as they take every opportunity to make some bucks before the next batch of bad weather arrives, which it tends to do with alarming regularity here on the wet & wild West Coast.   Saturday 28th Feb - no helicopters today Good job that we planned today as a go nowhere day as we got some real heavy downpours at times (the weather forecast was spot on) We wandered down to the cafe and shops (twice) and that just about sums up today. How to get a doctor's appointment at Franz Josef: There is a piece of paper with a list of times (for a Monday only of course) outside the community hall. You pick your time and write your name down next to it. As of today nobody had put their name down; must be a healthy lot around here. Apart from the tourists that is; the district nurse said her busiest time is late afternoon when the groups come back down from glacier walking - a twisted knee here, a sprained ankle there, here a bruise, there a cut, everywhere a ........................    The Youth Hostel has a stock of umbrellas in the entrance for you to use; that shows just how much it can rain around here. We were sat in the lounge area and there was a girl walking up the street to the hostel in the pouring rain, dragging one of those umbrellas behind her; all  twisted and bent. She must have encountered one of the gusty winds we have been getting; she has got some explaining to do to the hostel staff. 'Well, it was like this, you see.................... And talking about the rain: The rain today was like taking a variable shower; most of the time it was on a gentle level 2 or 3 but then without warning we would get a short burst (5 to 15mins) on a level 9 or 10 as though somebody had suddenly yanked the shower lever right round to the top. That was ok when we were indoors looking out and saying glad we are not outside in that. The big risk when outside was you could start, to say, cross the road and before you got to the other side you would get a level 9 or 10 thrown down on you. Believe us; an umbrella in that situation is of no use whatsoever - you get wet from the ground up!
"
40,"A lazy day doing nothing much in the morning, apart from a short bush walk, a coffee, a visit to the Information Centre and also to the Internet place. It was raining again (now there's a suprise), heavy at times - it was that turning on and off of the shower once more. We had thought about going up to see the glacier and considered the following options:- 1: Walk there and back(that's about 10kms)    Conclusion: a daft idea in this weather 2: Ride there and back     Conclusion: crazy idea as it's on a gravel road which will be wet and    slippy and it's far too soon for Jo 3: Get a shuttle bus which costs $10 each return    Conclusion: the craziest idea of them all as that involves expenditure. Overall conclusion: Why bother as we have seen it before in 1999 in better weather than this. A far better idea would be in to sit in the Youth Hostel lounge, read our books, have some lunch, have a cup of tea, be nice and warm and dry and wait for our bus, due at 15:00hrs. Which is exactly what we did. As well as us on the Atomic Shuttle Bus there were already 4 other bikes on going up to Greymouth, including a Belgian couple with young twins. We did see some brief brightness on the 2.5hr journey but when we arrived there Greymouth was decidingly grey and wet and down in the mouth so we were glad that we had rung ahead and booked a cabin at the Caravan Park - a tent was not so appealing in this sort of weather; particularly our tent with it's iffy floor.    Luckily the supermarket was only a short walk away so we were able to get something for tea and also a bottle of wine to celebrate.....................???? Monday 1st March - First day of Autumn & first day for a while that Jo gets out on her bike. The first day of Autumn and it's still raining but only off and on for the morning and nothing heavy. Then, by early afternoon we got some blue skies and it was nice and warm (only just though) with just a light breeze - and about time too! Some heavy rain returned in the evening just to confirm what the weather people said on the news:- 'this has been the wettest and windiest February since records began 150 years ago' However, all is not lost as it looks like warm, sunny weather from late tomorrow for a few days at least  We got out on the bikes and did 40kms after lunch up the valley and back to test Jo's knee out; there was no reaction and that included going up a couple of hills which is all good news. The only thing now is to get back 2+ weeks of lost fitness; we shall be taking it relatively easy over the next few days. Important expenditure made today:- We went to The Warehouse in town (remember?.....'where everbody gets a bargain') and I got myself another pair of reading glasses. Inflation had taken hold since my last pair and I had to pay $10 and another $5 for a case. On that cost basis this pair will have to last me 5 years if they are to be of  the same value as the last pair - there's absolutely no chance of that happening.      Conversation overheard by Jo in campsite kitchen: Old Chinese Man: 'Hello, where you from?' Other Old Oriental Man: 'Viet-Nam' Old Chinese Man: 'Ah, Viet-Nam................'How you get here?' ...... Pause Other Old Oriental Man: 'By Plane' "
41,"1 - If it was an earthquake then being outside was really no safer than being in his van. 2 - I'm the only one stood outside in the pouring rain. That story was going the rounds at breakfast time - poor guy.    The rain had stopped by early morning and we awoke to some bright skies and with a dry day forecast and a southerly wind (we were going north) things were looking up. We weren't going far today so we had a lazy start and didn't leave Greymouth itself until after 11:00hrs.      This section of the West Coast from Greymouth towards Westport is very picturesque as the road runs for a lot of the way between the bush forested hills on one side and  the sea on the other with the waves crashing onto the shore. The road dips and rises quite a bit but that provided some excellent viewpoints. We were stopping at regular intervals just to; admire the view, take a picture or two and make sure Jo's knee was ok and she wasn't over doing it - no problems there at all.     Punakaiki is more commonly know as 'Pancake Rocks'; it's a small hamlet with various accommodation types, including a campsite by the beach where we were staying; a Visitor's Centre and cafes which all serve the local attraction of the Rocks. I am sure they have got some fanciful geological history but essentially they are some unique stratified limestone rocks which look like pancakes piled on top  of each other (using your imagination of course). The big attraction though are the blowholes which at high tide with a south westerly wind blowing can be quite impressive - well, they were on our visit in1999. On the campsite with us was a local rural school outing; the whole school, all 50 kids (ages from 5 to11yrs), 3 teachers and 22 parents just having a few days away together - they were having a great time; something that you couldn't quite get with a larger school. Unfortunately their school is under threat as part of a nationwide education reform that's going on at the moment which will ultimately result in the closure of a lot of the smaller, rural schools - a shame.       High tide was at 20:20hrs so we walked back up to Pancake Rocks to see if the blowhole was showing off; it was but only a little bit, the wind needed to be stronger and in a slightly different direction so it could whip the waves up. The evening light was good though and the rocks area and coastline was quite photogenic.It was dark by 20:30hrs so rather than go straight back to the campsite we diverted via the local pub and had a couple of jugs of Monteith's Black (brewed in Greymouth and an  excellent drop) - went down a treat. There is no shop in Punakaiki, the cafe has some basic foodstuffs but if you want some milk after the cafe has closed for the day then the pub is your answer. Somebody did just that whilst we were there. 'Jug of Monteith's Black and a litre of low fat milk please' 'Do you want a glass for the milk or is it to takeaway?' Geological update: According to the signs at the Rocks the scientific boffins are at a bit of a loss as to exactly how these limestone rocks formed. The only thing they seem to agree on is that there was a secondary process involved called 'stylobedding'  - and we thought that was a mattress making company. So now you know."
42,"     We left late again, about 10:00hrs and took our time initially as we were stopping regularly whilst we were alongside the sea. Eventually we had to climb away inland, say our goodbyes to the West Coast, and tackle the ups and downs to Charleston for a lunch stop - the only facilities on the way to Westport. There were a few more bumps before things levelled out for the last 10kms or so into Westport and by the afternoon, out of the breeze the sun was lovely and warm; people sat outside their vans and and cabins soaking it up. It's not been like this since January! Quite a number of other cyclists on the campground by the end of the day; an American couple from Oregon, a French couple on recumbents, towing 2 Rann Trailers with 2 small children - with a sign saying they were on a World Tour and one other solo guy who we saw arrive but never saw again. "
43,"We were lazy getting up and slow to get away, taking our time over breakfast; talking to other people; going to the internet place and the supermarket in town etc. As this tour has gone on we have slowly changed from getting up and off on the road early, regularly between 08:00 and 08:30hrs to the situation now that we are in no rush whatsoever. Think it's the fact that the tour is coming to an end; the main aim has been accomplished (well, it was nearly); we have got time on our hands (& legs) and Jo's injury has generally taken the impetus out of the need to be anywhere by a set date - other than Auckland for our flight home on the 29th March. We could well find ourselves now doing more short days; spending a few days in one place; doing some walking or doing nothing in particular, all weather dependant of course but surely March can't be as bad as February was. It's got off to a good start so let's hope that's a good sign. Today was a picturesque ride up the lower Buller valley; wide river, wooded hillsides and no steep hills. The only facilities on route was the small historic Berlins Hotel where we stopped for a coffee and pie. The Pedaltours cycling company were setup for their lunch in the garden awaiting their riders who were scattered down the road; some would be finishing lunch before others had arrived.    We were at the small store at Inangahua Junction by 13:00hrs and over a cup of tea contemplated what to do. Murchison was a bumpy 50+kms further on and the only facilities before there was a basic DOC campsite about 25kms away. There was a backpackers down the lane so we wandered down there and straight away decided to stay. A beaut little spot, very quiet and tents allowed in the garden so before too long we were well established and resting the afternoon away - Inwoods Farm Backpackers is the place - it comes with a recommendation. The only issue we had was what to have for tea. We had practically nothing with us apart from bread, peanut butter, some ham and tea bags; we were a bit lacking in forward planning today - we really are getting lazy and need to buck our ideas up or else this tour will completely fall apart. The store was basic, very basic with very limited foodstuffs - you could get takeaways; get some booze; hire a video (you could make an evening out of those 3 things). The big problem though was the shop shut at 17:00hrs so a takeaway was not an option. We came out with 6 eggs, a couple of potatoes, an onion and a tin of fruit........and seeing as it was quite hot outside a couple of icecreams to eat now. So for tea it was omelette(pots, ham and onion) on toast with sliced peaches for afters and breakfast looks like it's more toast with the peanut butter. Will that breakfast be enough to get us to Murchison and possibly beyond or will we have to call in at the store before setting off and scrounge up something else? - a takeaway perhaps. Read tomorrow's 'exciting' episode to see what unfolds........... A young Dutch cycling couple (Guert & Marilee) turned up who we last saw at Papatowai on the South Coast 2 days before Jo's accident. We had a good chat in the evening on all things cycling.   "
