,blog
113,"But the slow pace is totally appropriate in such a beautiful area. The road is also perfect for cycle touring - this is one of the most remote parts of the north island, so the traffic is virtually nil. I went for long long periods where I didn't see a car or anyone. In the end, I started shouting out loud, singing like a loony, stopping, and just soaking it up.  Most of today was actually inland, cutting around the northern edge of the East Cape, but the hills here are also large and dramatic and more than enough to keep me happy. The last hill of the day was a killer, but my destination was the Motor Camp at Te Aroroa, where the only eight people camping there were all cycists - me with the trailer, a family of four germans on two tandems (the kids are 4 and 5 yrs old!), another german couple and a Dansih guy who was riding the whole 350km of the East Cape in two days. And boy could he talk. Where 10 words would do, he'd rattle off about 100. man, he was dull, and dominated conversation so much noone else could get a word in. AND I offered to share dinner with him, cooked it all, and he didn't lift a finger to clear up. Grrr. Now on the East Coast of the East Cape, it's the mearest bit of mainland to the International Date Line, so everything is the ""first _____ in the World to The Sun"" or the ""Most Easterly _____ in the World."" Initially this may seem exciting but, really, it's not - I mean, the date line is an aribtrary thing anyway, so getting up at 5.30am to see sunrise is kind of daft - it's no more special here than anywhere else. I still did it one day on the East Cape though. I guess that thinking the other 8 billion people in the world aree still to see the nth of November is a little bit interesting. Seeing anm advert for an Irish Pub in Gisborne which described itself as the ""most easterly Irish Pub in the World"" was the last straw.  For a time, I was the ""Most Eastern English Guy With A Bob Trailer in the World"". Wow. There was a power cut in the evening, it was mild and clear, and I had a new sleeping bag that actually kept me warm. Therefore, i figured I'd sleep outdoors - a little nervous, just because I've been a townie for too long, I settled myself in the bag, and turned off the head torch. Bliss, look at all those stars. One minute later there was an almighty angry hissing noise in the tree above. I flash on my torch to lighten the eyes of a possum howling at me. I was back in the tent about 15 seconds later.... Andy c - man of the wild. Not. Possums aren't going to attack, but it seemed easier just to be in the tent.
"
114,"Ho hum. And so it turned out to be one long long long slog. My legs struggling like never before, and I couldn't stop myself watching the odometer. Every km was taking longer than it should. I had to stop and kip a couple of times, but after an eternity, a summited the final climb, and flew the 9km down to Tokomaru Bay, where the East Cape living really showed itself. I stayed at Brian's Place, a small hostel with an amazing reputation. Brian's 50yrs old, so laid back he's horizontal, and runs a cosy hostel slightly up the hill looking over the wide and cliff-lined bay. There's no better place to relax.  the first evening was NZ-Oz semi-final day, and a friend of Brian's, Wayne, invited everyone in the hostel (6 of us) to his house to watch the rugby with his sons and their friends. What a fantastic evening. they were all so welcoming, and shared their day's catch of Crayfish, Moki and kinner (sea urchins - a very strange thing to eat!). Of course, the result went the wrong way, but we had a greeat time. After waking up the next morning with a hangover, I did a whole day of nothing. Nopthing at the beach. Nothing in the hammock. doing nothing is so easy when you cycle - there's no guilt at just loafing around in a hammock with a good book. The only real activity I did today was go look at Wayne's boat that he's building - a 60ft schooner that's taken him 12 yrs so far, it's nearly ready, but is currently sat in a sheltered field, looking pretty incongruous. But, it's his passion, nearly ready, and when it is, off he goes around the world. A man with a good philosophy of life - just do it. Don't fret about money, don't fret about anything, don't even plan too much, if you want to do something, go for it, and it will work itself out. I'm not massively sure how much I can do that myself, but I do try to take some of it with me.  Rounded the day off with more rugby. go England! Very excited about watching the final this weekend!
"
115,"About 15km later, I pull up alongside 5 other cyclists in a tiny patch of shade. And instantly make great friends. Danny (irish) and Anche (german) are riding together, and Marielle (canadian) stuart (english) and Bec (english) are riding together. The threesome are heading just up the road to a DOC campsite at Anaura Bay just up the road. I'd kind of intended to go there, but had forgotten about it. Instant decision made - I'll ride with them; there's a possible food issue, because I didn't plane on stopping before a store, but there you go. And the bay is heaven. Isolated, and with big surf, we pitch tents and go body surf for an hour. Oh man, it was just so much fun in the sun. Good people, great weather and great sea.  An hour after we got out of the water, the weather begins to change. Wind and rain become the order of the day. Bec and Stuart are a couple and have a nice solid dome tent. My lightweight single pole tent is no use and keeps collapsing in the wind (it was real wind). Marielle's tent is nine years old, has no pegs, has wholes in the outer, and zips that don't work. Still, my tent was in such a bad state, I had to abandon, and spent a sleepless night in marielle's seive getting battered by the wind. Still, that's what camping's about sometimes, and it's still fun. We'd pooled our food resources and the best we could do for dinner was baked beans and rice with some butter and Vegemite mixed in. Yum.
"
116,"But not as much as a shocker as the weather. Intermittent showers, but the only thing that was not at all intermittent was the brutal headwind. All day. With intermittent gusts that tried to take you off your bike completely. I'd decided to stick with Marielle, and we would meet up with Stuart and Bec in Gisbourne. It took us 9 hours to do the ride. The wind was killing us completely, but still, it remained fun - 100% good weather would be boring, and even thought it was hard, I'd still have done it no other way. We met up with Danny and Anche for a while and had a comic lunch stop/collapse in the middle of nowhere right by the side of the road, at the top of a horrific climb that wiped us all out. The last 5km were spent with thoughts focussed completely on food. And the fish and chip shop next to the campsite was most welcome, and between us we kept their business going pretty well. And, boy they were good fish and chips too."
117,"Initially, Gisbourne seemed a grim place, but I think any cycle tourist would have a hard time thinking positive thoughts about a city this size after riding the East Cape. A day wandering around though reveals another friendly, attractiove little town, with plenty of cafes and places to keep you happy. For a bit of culture, off I went with Marielle to the local museum which was great. The highlight was the historical photos, and the sections on the history of the town. on the way out, I randomly asked at the desk if they knew anywhere that I could learn to weave with flax. and it turns out I am standing next to a woman who teaches free course every friday back in Tolaga bay. Hurray. So, Friday morning, off we go back to the east Cape to get some basketmaking done. I really can't wait! Most of the rest of the day was spent loafing around and playing hacky sack. Nice to find some people who can do it! And Stuart and Bec got engaged! Amazing."
118,"Maybe it's the hacky sack opportunities. Maybe it's the people. Either way, I've not been on the bike for ages, but i've been having a fantastic time.... read on for the full story of the weekend."
119,"The weekend began early on Friday with a ride up to Uawa with Cynthia, the woman we met at the museum. She works at the museum as a school educator, and spent the day showing myself and Marielle around the township of Uawa. I won't go into the details of everything we learnt, partly because there was so much to learn, it was a little overwhelming. Also, I unfortunately am still struggling to absorb all the Maori terms . But, we both learnt masses about the area, their sacred river, their Maunga (sacred mountain), Titianga, and were also shown around all the local Maraes.  We even got to visit Uawa's new radio station, on the day of its official launch - a big, by Uawa standards, street party with most of the community outside the converted old post office. To see this kind of operation in such a small town - about 700 people - is warming, and just one of countless indications of how this town is tightly knit, and rediscovering its own roots and culture following generations of repression of the Maori heritage. For example, did you know their was an act passed in 1911 that banned Maori women from breast-feeding?  We were being introduced to countless numbers of people, and everyone in the area is related to each other. The Whakapapa (geneology) is extremely important to the Maori, and everyone is very aware of their relatives. Everyone we met welcoming, their warmth and generosity really puts us to shame. When Marielle, Stuart, Bec and I had cycled through this town a few  days previously, we had barely stopped, and I confess I left with a feeling that this was a quiet uninteresting little place. As time went on the town opened up to us more and more. At the end of the day, we headed back to Gisbourne, but ready to return on Saturday morning to begin the weaving classes. I've written about the baskets on the following page. Still piling on the good vibes, we were invited to spend the night on the Te Rawheiro Marae. The marae is a very special place, and we were pretty lucky to be allowed to stay there. And the view fromt the front door was magic. Our evening we spent in the town hall, watching Whale Rider with the locals.  There's really no way to satisfactorily sum up this weekend. Everyone was wonderful, the maori culture is fasicnating, and I can't really explain how special it was to be part of the community for the weekened. I'll be cherishing these memories for a long time. Photos up at http://andycotgreave.fotopic.net"
120,"In Uawa, an initiative has been established by the community to redevelop and strengthen Maori heritage. In the town of Uawa, there are exhibitions of past and present artwork and artefacts, and also 3 months of workshops in all aspects of Maori culture - weaving, weaponry, jewellery, cooking, moko (tattooing), etc. This is all funded by the community and the government and is free for participants. Myself and a friend, Marielle, were fortunate to attend a weekend of raranga. The weaving is all created using flax, an incredibly plentiful plant in this country - as I cycle around, it really is everywhere. The plant can be harvested twice a year, cutting the correct leaves from the plant. I was going to make a small kete, a traditional basket with a plaited base, and for this I had to cut and prepare 40 flax leaves.  The leaf is long and tough, and to get from a leaf to a strand to weave with requires several easy steps and one rather tricky one. The spine and edge of the leaf is removed with the fingernails, that's easy enough. The next step is to remove the top of the leaf from it's spine, a process involving stripping out the fibres by pressing your thumb hard against the leaf and pulling. Done properly, as many of the others there could do, you end up with an attractively frayed end to your flax, with all hoirzontal fibres, the moka, removed. Done by me, I got a few of them right, but lots wrong; nothing a quick comb through wouldn't fix though! Armed now with my prepared flax. it was time to get going. The frayed ends of the leaves were plaited together to create a herring bone pattern, a challenge in itself to keep everything held together - my thumbs were cramping up almost immediately. Once the plaiting is finished, the flax is held together by a whiti (I KNOW I have spelt that incorrectly!) - a tight plait. The next step is to fold over alternate strands of my herring bone pattern of leaves and start creating the shape of the kete. In many ways, this stage is almost the same as making a regular open weave purse, but with the whiti in the centre. Using the flax is amazing during this process, it's such a strong and flexibly material. During all the weaving, there were plenty of opportunities to speak to the rest of the weavers, all Maori women, mostly local, with differing levels of experience. Inevitably, their kete were looking a vast amount better than mine, their experience apparent. But all were encouraging and helpful, and free to offer tips and advice. Plus they all seemed to spend more time gossiping than weaving! All day the area was full of laughter. By mid-afternoon, my basket sides had taken shape, and I spent the rest of the day plaiting a rope to form the handles. A simple process, but one where you could turn off your brain, and get into a really nice rhythm.  By the end of the workshop, I had a rather ramshackle looking kete, especially compared to some of the other's output, but this was mine, and I am extremely glad to have spent the time learning the skills, in the 'proper' setting!"
121,"Everyone, bar ONE person, I have met on this trip has been friendly and kind. Who was the sole person who had a broom up their ass? The main teacher of the workshop, Connie. Marielle and I arrived not really knowing what to expect. When we were introduced to Connie, her reaction was one of utter contempt, an attempt by her to convey, I dunno, either exasperation at these novices, or a complete lack of enthusiasm for teaching Pakeha. I dunno, but throughout the day, she would not so much as smile at us. I told her I would like to make a kete, and that I had made several square baskets before. ""no you haven't"" was her reply, said with venom. At every step of the process, she would belittle our efforts ""hmm, looks like you've done that step, well, it looks okay, I suppose"", and with reluctance bordering on physical pain she would show us the next step of the process.  Thankfully, everyone else in the workshop was completely open and friendly, and there were plenty of others to show us the process, and give us the positive encouragement we needed.  Speaking to some of the younger people in the community later it seems she's like that with many peopole but it did make for some uncomfortable moments. Is it because we were white, and she somehow didn't want us to learn the Maori ways? Who knows, but she was quite an experience. Don't worry, though, despite this one bad egg, the weekend was still wonderful, and she couldn't come close to leaving me with bad memories of the weekend."
122,"Right. I had thought about just getting the bus straight from Gis to Welly, but no, the extra cost (particularly of putting the bike on the bus - $20 every journey) would be worth it. On the bus, it starts raining. And doesn't stop for 48 hours. So, off the bus I get in Napier, only to hurry to a hostel, then hurry to a cafe where i can spend the rest of the day reading. Back to the hostel for the evening, and hoping to wake up to sunshine. No, I wake up and the rain is even heavier, so I spend the rest of the morning in the hostel, and only head out for lunch. Back on the bus, it's still pissing down, another twenty dollars for the bike and off I go to Welly. * Conclusion - Napier didn't do it for me! I did meet a friend of Sheila F's in Napier for lunch though, Sarah, who spent two years on the same 4H Summer Camps in New Hampshire as I did, so it was fun to meet someone with common memories from New England. * This twenty dollar charge is great for the bus company. I only get to take my bike on the bus if there's space. So, the money doesn't go to any kind of reservation for the bike. And then, once I've paid the 20, *I* then get the privilege of putting the bike on the bus myself. So, the money's not going towards any extra work for the driver. At the other end, I get to unload the bike too. Er, so, Mr Bus Company, why am I paying this money? It doesn't reserve me anything, and it doesn't get me any special treatment either. Harumph.
"
123,"In the evening, I was set to meet up with my riding buddies from the Lake Taupo race I did in October. We'd arranged to meet in a pub, and even though I'd only had one beer when they arrived I already felt really wobbly! Must be the lack of drinking I am doing on this trip... We had a fun night though, Claudia Kath and Liam are a great laugh.
"
124,
125,"My riding buddies for the weekend are eight people from Wellington, all connected by New Zealand's biggest mountain biking website, Vorb. Some I have met on other rides in other parts of the country, but some of the others are new faces. Vorb has a busy online forum that appeals to all riders, and that's reflected in the spectrum of bikes between us. At one end, a couple of XC race bikes, at the other is Juan's Big Hit, with 8"" of travel. It promises to be interesting to see how he will get up the one-in-three climbs ahead of us.  There's no roads to the beginning of the trail at Ship's Cove. To get there we get a water taxi. For the Kiwis I am with, this is just another journey, no big deal. But, er, a water taxi? How cool is that? Once they've dropped you, your bike, and your friends off, they even take your bags to whichever hostel in whichever bay you're staying at that night. And at the end of the ride, they pick you up again from the trail end. It may just be me, and my land-lubber ways, but this whole water taxi thing is pretty exciting. The trip out to the trailhead also provides us with some tantalising and daunting glimpses of the trail; dense green bush hugging steep slopes contrasted against a perfect blue sky.  Once dropped off, and satisfied that we have taken enough innuendo-soaked photos of us playing on the cannons at the monument to Captain Cook - he landed here on his global voyages - we can't put off the start any more. A shame because the first 2km of the climb go from sea-level (obviously) to 500m. Today we have beautiful weather, but it has rained for the previous three days, so this ""Can-I-can't-I?"" climb unfortunately becomes a walk. The top is a relief, and provides a taste of the views to come. Behind us is open sea, strewn with steep-sided, forested islands. Ahead are ridge after ridge of mountains, the sounds below radiating a deep greeny-blue. With the hike-a-bike out of the way, we can press on and enjoy the first descent.  The trail varies between narrow and wide singletrack, with many different surfaces. Sometimes you are passing through slippy caramel-coloured clay, keeping the bike balanced to maintain traction. At other times you may be on exposed rocky ledges, riding carefully to keep yourself on the trail. Or you maybe floating the bike over dense networks of roots. Riding the trail is like a Greatest Hits compilation CD of biking. Track one is the rocks of the Brecon Beacons, track two the high Alpine environment of Colorado, track three the parched Andalucian mountains. The vegetation, too, is a marvel. To the native New Zealanders, it may be less exciting, but to a visitor, there's plenty to excite. At lower levels the fauna is dense, reminding me of Tarzan cartoons, but as you rise higher, it dries out, through beech trees, to stubby bush, exposed and sun-hardened. The many gaps in the canopy allow eye-widening views of the Sounds. But don't look too long - there's always a rock placed on the trail to catch you out as you gawp, jaw open, at the view.  Lunch is reached at the end of a 3km downhill section that has me repeating the mantra ""flow"" over and over again. The big-travel boys have disappeared in the distance, but I battle it out with Tama, both of us matched on our hardtails, vying for position. He wins this one, but it's a scream to flick the bike round each corner and try to out ride each other to the next narrowing of the trail. Our lunch stop is a hotel accessible only by boat and trail, allowing us to giggle while supping some refreshingly cold beer.  Once fed and watered, the afternoon spin is ideal for the lightweight hardtail boys and girls in the group. There's plenty of descending and ascending, every drop and climb short and steep. I go at it with legs pumping fast. For the past ten weeks, I have been riding fully laden with touring kit; I am used to riding a bike that handles and accelerates like a slug. And here I am, fuelled by endorphins and a little beer, on a bike that feels lighter than air, with legs loving their release. My rhythm is right on, and the more the climbs make my legs burn, the more my determination to get up them faster increases. This only goes to make the descents even more frenzied. The final drop to Punga Cove is the steepest and most technical of the day, with some hairy rooty drops to give us a final adrenal injection.  Our hostel for the night is a collection of buildings nestled into a tiny cove with a bar at the wharf. There is even a restaurant to feed us, and once we've swam, showered, napped and calmed down, we go to fuel up for the following day. Disappointingly, the restaurant is aimed at boating day-trippers. The food is very nouveau, i.e. expensive and comes in tiny portions. It's not the ideal biker's meal, but it's tasty, and makes a change from the bland rice and tuna that I normally cook for myself while touring."
126,"We're starting at sea level again, which can only mean that the first thing to do today is another climb. Like the start of the previous day, we need to get to the top of the ridge, but at least today we have a hard-packed gravel surface on which to tease the stiff legs into action. The reward for this climb is a stretch of riding along a ridge-top. For 20km we undulate with the ridge. On one side is a view similar to an alpine glacial valley, with meadows on the base and forested mountain slopes. The other side of the ridge looks out to the open sea. The trail leap-frogs from one side of the ridge to the other, giving us views of both.  The end of the ridge drops to Torea saddle, 50m above sea level. Ahead is the most talked about climb of the day. This is the one my riding friends have been talking in hushed terms about all day. Only the greatest riders in New Zealand have ridden it all, they claim. The trails rises painfully from here to 520m in just 3km. It is daunting, but my legs were ready and I had a bag full of determination to make it to the top, ideally in one shot. It was a granny-gear killer. With legs straining right from the start, I have to keep a really tight posture in order to prevent the front wheel lifting, toppling me back down the slope. With heart rate at its maximum, and head exploding in the 30 heat, I eventually could see the top. But as soon as I had seen it, I could no longer keep the front wheel on the ground, and slewed off trail into the bushes. All that effort and I'd been beaten right near the end. Despite this, I was totally pumped up to have gotten this far up the trail.  With every gruelling climb, there comes a descent. The descent was rocky and exposed, requiring deft handling to corner round the multitude of switchbacks. The trail builders surely had mountain bikers in mind as the further down the trail goes, the steeper and more frequent the switchbacks become.  Resting and refuelling at the bottom of this descent, it was apparent that everyone was beginning to tire. ""There's only one more climb,"" our guide, Tama, tells us. Inevitably, the climb was another Escher staircase climb. Riddled with switchbacks, and with no view of a summit, each corner presents the rider with yet another wall to climb. Finally, the top was reached, and now was the grand finale, a 12km blast to the sea. Body tired but brain focused, this was a blur of rocks, trees, exposed rocky sections, and beech-leaf lined wooded sections. There were plenty of short, sharp climbs to muscle the bike over. My legs were burning, but I was racing as fast as I could, trying to process the visuals as best as I could. My body was making many of the decisions itself, weight distributing itself automatically to get the bike over, round, or through any and all obstacles. Jono on his Santa Cruz Bullit was just ahead of me, and I pushed it to the limit to keep up with him on this one.  With one last straight descent, we spat out of the end of the trail. To find a caravan selling tea and ice cream. As our group emerged from the trail, I think we spent enough money to keep those guys going for several months. We simply couldn't eat enough pies and ice cream. We ate greedily, grinning and sharing stories about the ride. We'd all made it in one piece, with no mechanicals, not even a puncture. With the arrival of the water taxi, our long journey home began - water taxi first, then 3hr ferry back to the North Island and then a 3km ride back to a friend's house. It would be a long weary journey but one happily undertaken, my tired mind not thinking about my hurting legs, but instead replaying any of countless great snapshot memories from the weekend.
"
