,blog
60,"Cows turned out to be a major source of entertainment on my trip, but there is much about them I don't understand.  For instance, almost without exception cows would stop what they were doing and stare at me as I pedaled by.  They never turned their bodies, only their heads.  Some would moo at me, but most just stopped and stared.  And then there was the cow that played 'chicken.'  I was pulling a steep hill outside San Juan Bautista when I encountered a huge cow standing squarely in the middle of the road in the right hand lane.  I figured she would turn tail and run as I approached, but not this Bossie.  She stood her ground, head lowered, ready to defend her turf I guess.  I wondered if she was a member of some sort of cow gang.  Anyway, I dismounted and walked the bike around her.  She never moved a muscle so I can only assume she was having a bad hair day or something.   Okay, back to my travels.  Today was my official 'Dawdle Day.'  The calculated distance to Monterey was less than 40 miles so I decided to take my time, gawk at everything and just smell the roses.  It turned out to be a good plan. Once again I was faced with a steep climb almost immediately after leaving camp at Mission Farms on the way to Salinas.  The road has several, descriptive names including San Juan Canyon Road, Old Stagecoach Road, San Juan Grade Road and Salinas Road.  There were about four miles of leg-numbing pedaling before I reached the top, but the view from the crest was worth the effort.    About half way up I encountered 'chicken cow.'  I was also treated to a long stretch of wild roses growing alongside the road.  The bushes were in full bloom and the smell was incredibly sweet.   Dropping down into the Salinas Valley was another treat.  Although the road surface was rough and full of patches I didn't mind the slow pace.  There were so many things to see that I didn't want to miss a single thing. At one point I passed what had to be biggest strawberry field in the world.  It must have been two hundred acres in size.  The berries were bright red and absolutely huge.  My mouth watered for a taste but I couldn't bring myself to pick one.  The old Christian ethic was at work again.  I waved to many field workers along the way and they all waved back.  Many gave me the thumbs-up sign.  I silently thanked them for their hard work. Salinas seems to be a nice little town.  The drivers were polite and quick to share the road.  The only bottleneck I found was just south of town on Davis road, and then only for a short stretch of shoulderless pavement.  Before heading west again I stopped at restaurant with 'Waffle' in its name and fueled up.  I had ham and eggs, toast and hashbrowns alongside a huge strawberry waffle.  The waitress was skeptical that could finish my meal but obviously she didn't know much about bicyclists.  I did everything but lick the plate. I headed south out of Salinas and picked up Reservation Road going west.  It wasn't too long before I entered the town of Marina.  At the intersection of Reservation Road and Del Monte Blvd. I found the famed Monterey Bicycle Path.    It was a real treat not having to worry about automobile traffic.  Of course there were joggers, skaters and other bicyclists on the path but they posed little danger.  As I proceeded south I could smell the ocean.  Finally, I got my first glimpse of Monterey Bay and I was ecstatic.   I continued down the bike path following the Pacific Coast Bicycle Route until I came to Pearl Street and the approach to Veterans Memorial Park where I planned to spend the night.  The climb to the park was every bit as brutal as others had described and I ended up walking my bike part of the way.  But I eventually made my way to the main entrance and found the hiker/biker area.  I searched for a level place to stake down my tent but something inside me just didn't feel right.  There were a couple other tents there, but no people.  My gut feeling was so negative that I repacked my trailer and left.   I found a reasonably priced motel on Fremont Blvd., checked in and took a long, hot shower.   Then, with the trailer stored safely in my room I headed back to the beach area and the municipal wharf.    I spent a lot of time looking at the boats in the harbor which brought back many fond memories from my childhood. My father was a commercial fisherman out of Seattle so I was no stranger to boats, docks and sea water.   Then I rode down to Cannery Row and checked out all the tourist traps but didn't spend a dime.    From there I rode further along the bay on Ocean View Blvd. before finally heading back to my room.    There was a Denny's just down the street where I had dinner before going to bed.  Day three was as good as it gets.
"
61,"  Today's ride would mark the first time on the whole trip that I didn't have some sort of headwind to contend with.  In fact, there were times when the wind was actually at my back.  What a strange feeling it was to see the flag on the back of my trailer hanging limp while my bike computer showed me moving along at upwards to fifteen miles per hour.  Hey, I could learn to like this. Riding along the Salinas Valley reminded me that this is one of the richest agricultural regions in the entire country.  Lettuce was the most recognizable crop being grown and the fields stretched for miles in all directions.  The crops require an enormous amount of irrigation and I was treated to a brilliant light show from the morning sun making rainbows in the spray.   I tried to capture the colors with my digital camera but it didn't work.  Despite the beauty all around me, I kind of missed the cows. After a couple hours on the road it felt like my bike and I were on autopilot.  The road was nearly flat so there wasn't a lot of shifting to do.  There weren't many curves to negotiate so steering was pretty much fixed.  I was just cruising along in my own little world while my mind wandered aimlessly.  Then, out in the middle of nowhere I saw a sign announcing the entrance to Mission Soledad.  What a surprise.  I hit the brakes, jogged right and found myself  sitting in front of another Spanish Mission dating back to the eighteenth century.    The place was deserted except for a small mobile home on the edge of the property where I assumed the caretaker lived.   I wandered the mission grounds for nearly thirty minutes, completely alone, trying to envision the Padres as they ministered to the Indians or the occasional settler.     The grounds showed signs of being well cared for and there were many flowers in bloom.  I sat on one of the old benches, wishing it could talk, but it stayed quiet.    After a refreshing drink of cold water from a faucet by a rose garden I reluctantly got back on my bike and once again headed toward King City. I have only been to King City once before but I kind of fell in love with the place.  Actually, I fell in love with the San Lorenzo County Park on the outskirts of town.  The park is more than just another place to spend the night.  Rather, it is a history lesson with campsites.  Just beyond the entrance station are rows of antique farm equipment on display.  There is an old, one-room school house on the grounds sitting next to a turn-of-the-century railroad depot.  In the middle of everything is a huge old barn which has been turned into a museum.   Tonight I would have company in camp.  My wife, Merleigh, drove over the mountains from home to be with me.  She brought a slightly bigger tent that the one I carried as well as her own sleeping bag and Therm-A-Rest.  It was really great to see her again.  After a quick shower and a change of clothes we went into town.  I brought her up to speed on my travel adventures over dinner.  Then, as I contemplated the next leg of my journey, I made the decision to forego the extremely difficult route back over the mountains.  The next morning I tossed the bike and trailer into the back of Merleigh's pickup truck and traveled to Coalinga, California in style.
"
62,
63,"As there were no apparent campgrounds nearby, Merleigh and I began searching for a motel room for the night.  The woman who worked in the Chamber of Commerce was very enthusiastic about a bed and breakfast in the vicinity but I wanted something a bit more conventional.  So off we went in search of suitable accommodations.  There were numerous motels from which to choose but we didn't see much that didn't bring the name, Norman Bates, to mind, so we headed out of town to Interstate 5.  We found a nice Best Western at the intersection of highway 198 and I-5 and settled in for the night. The following morning I was in the shower by 6:15 a.m. and out the door soon after 7:00 a.m.  Merleigh saw me off and then went back to bed for another hour of sleep.  As for myself, I was anxious to get back on the bike.  It promised to be a warm day with a breeze from the west.  It doesn't get much better than that. This part of the San Joaquin valley is much like the Salinas valley in that it is basically flat land with extremely rich soil.  Once again I found myself riding adjacent to heavily irrigated fields with arrow-straight rows of greenery.       Even better, I rode past a number of dairies as I approached Hanford, so the cows were back.   I also ran across a small, picturesque ranch with some sheep grazing beneath a few shade trees.  There was an ewe with a tiny little lamb at her side.  I tried to take a picture but the wary mom led the baby away before I could get a closeup.   I stopped at a fast food joint for a bite of lunch in Hanford but the kid behind the counter had an 'attitude' so I walked out.  I have made a pact with myself to no longer put up with snotty service people.  I found another place nearby and the young woman behind the counter made me feel like I really meant something to them.  I thanked her for the service and hunted down the manager to let her know what a great employee she had.   After a satisfying lunch I continued on toward Visalia.  The plan was to spend my last night on the road at a KOA just outside Visalia even though it would put me a mere 35 miles from home.  I arrived at the campground just in time to fall into line behind a couple with a beautiful, 34 foot 5th wheel.  When it was my turn to register the lady behind the counter asked me what type of RV I had.  I told her it was a three foot travel trailer.  She looked me straight in the eye and asked the question again.  I pointed out the door to my bike with my BOB Yak trailer.  She laughed and assigned me to a tent site with a big shade tree.  Merleigh showed up ten minutes later.  We set up the tent and went into town for a little sightseeing and dinner.  We returned to camp at dusk, watched the sun go down and went to sleep.  "
64,"1. Never once, while I was on tour, did I wish I'd stayed home and watched Oprah.  2. Gasoline prices were at record high levels.  I saw premium selling for $2.75 per gallon in one place.  I felt pretty smug knowing I had traveled nearly 400 miles and didn't buy a thimble full of gas.  3. Dogs were not the problem I feared they would be.  4. Automobile drivers were, for the most part, very thoughtful and courteous.  They gave my bike and trailer a wide berth, honked, waved and smiled at me everywhere.  5. You see things from a bike you would miss while driving an automobile.  6. People throw an incredible amount of trash along the roads from their cars.  I pulled into my driveway well before noon just as the kind lady who took care of my cat was leaving.  We chatted for a minute while I put my bike in the garage.  Then my beloved cat came out to greet me.  I thought I would have to have him surgically removed for a while as he wouldn't let me get more than six inches away from him.  I really wanted to take a shower but he wanted to snuggle in my lap.  He won. I consider my first long distance bicycle tour to be a complete success.  I achieved everything I had set out to do, and more.  What else can I say except that traveling by bicycle is great 'mental floss.'  So, would I do it again?  (grin) What do you think?  One last note  If you enjoyed reading about my travels, I would appreciate your taking a minute to sign the guest book associated with this journal.  Thank you.
"
65,"Most likely, we will both be doing some writing, and will try to remember to let readers know which voice is doing the talking.    We are using the ride as an opportunity to raise money for Habitat for Humanity.  Recently, I enjoy doing some work on a local Habitat house, and really like how the organization brings together skilled workers, clumsy workers, coordinators, donors, and new owners to work toward a common goal.  New owners then give back by volunteering some of their time to future Habitat houses.  Please consider supporting our fundraising effort by making a pledge.  You can do this by visiting the Guestbook.  100% of the money donated will go to Habitat for Humanity.  Thanks. Some helpful conventions about how this site works: Clicking ""Contents"" will bring you to the table of contents of our postings.  Clicking ""Figures"" takes you to a listing of all journal postings, including an itemized list of thephotos that we've posted. Clicking Slideshow brings you enlarged photos we posted, and allows you to scroll throughall the photos we've posted. Clicking Author brings up a short bio. Clicking Guestbook allows you to post a message to us which we can read.  I think that guestbookentries you post are visible to anyone.  We can also reply to you through the Guestbook, butour replies will go directly to your E-Mail address. Clicking the First, Prev, Next or Last buttons while viewing a journal page will bring you to thefirst, previoius, next or last journal page. Clicking any photo on a journal page will enlarge the picture, and put you in the slideshow mode.When in this mode, clicking the First, Prev, Next or Last buttons will bring you to the first,previous, next or last photo, not journal page. The progress bar shows you the relative position of the page you are viewing to the total number of published pages.  As more pages are added, the bar will get longer.  You can click along this bar to jump to another position in the journal without having to scroll back or forward repeatedly. Finally, I would like to thank Neil Gunton for designing this journal publishing web site and allowing us to use it to publish our own journals.  Thanks Neil!"
66,"I first thought of biking coast to coast when I was about 14.  My bike was my ticket to adventure.  It brought me to baseball games, downtown, on adventures with friends, and to rendezvous girlfriends.  Biking was as much a part of my live as food and sleep.  Then on my 16th birthday, I got my driver's license.  Although I still rode, other things in life took on greater importance.   As an adult, I have toured extensively with my wife, mostly in Europe - the two of us happily carrying our gear from village to village.  We actually met on a bike ride - a fundraiser for the MS Society Fundraiser in Minnesota.  My friend and I were passing  her while climbing a hill, and the thought of trying to strike up a conversation was all the excuse we needed to slow our climb. The rest is history.  As Judy tells the story, we were interchangeable.  She thought we were both cool guys in bandanas, and liked our company and attention.  In the end, we both dated her at one time or another, but happily, Judy and I ended up together.      I took to riding a mountain bike almost exclusively for 10 years.  Then last summer, I bought a Cannondale R2000 road bike, and was immediately taken with the smooth quick handling. Out of the saddle, climbing a hill, you could just feel the bike being propelled upward, all a result of your own power.  I just never got that feeling from a mountain bike.  So I rode a lot last year, and while on a 3 day circumnavigation of Lake Champlain with Judy and John, a close friend, the idea of a cross country ride was reborn in my mind.  Judy and I had talked about doing it sometime, but the timing wasn't great for her just now.  So John and I started talking about the two of us doing it.  The idea took on a life of its own, until we had talked about it too much to turn back.  So here we are.           There have been many equipment lists posted in other journals, so I'm only going to add a few general comments.  To make uploading this journal easier, I'm bringing an Apple 12"" PowerBook and a Canon Digital camera.  Since we are staying in motels, most of which will have phones, internet access should be fairly easy.  I've packed the computer in a kayaking dry bag which, in addition to being totally watertight, allows you to blow it up a little providing some cushioning.  I was advised to put a little envelope of silica gel inside to keep the potential dampness out.  I also am bringing a Suunto Vector wrist computer mounted on my handlebar.  It provides altitude, compass, temperature and barometric information.  Finally, I'm bringing an ipod with over the ear style earphones for those long isolated stretches. (For safety reasons, I'll only use one earphone.) Most of the tool lists I've seen are way overdone in my opinion.  We're bringing all the obvious tools for tire repair, a small multitool, small bottles of chain lube and degreaser, a shop rag, and that's about it.  We're not bringing cable cutters, freewheel removal tool, chain tool (our chains have a removable link, so none is needed), etc.  Hopefully, these will be wise choices. Thanks to all who have supported us, some of whom thought us crazy, but supported us anyway.  And to all who have pledged a contribution to Habitat for Humanity, a special thanks.  But mostly, thanks to Judy and Cher, our wives and partners who have encouraged us every step of the way.   "
67,"Addison Independent3-22-04 By PETER CONLONMIDDLEBURY - When biking buddies Dan Borden of Cornwall and John Stark of Middlebury hit the road on their Cannondales next week, they hope to accomplish two things: complete their 3,160-mile journey without incident and raise $5,000 for Addison County Habitat for Humanity.On Thursday, the pair will fly to San Diego, Calif., where they will begin a journey that could take them through snow in New Mexico, searing heat in West Texas, and stifling humidity along the Gulf Coast. Their destination is St. Augustine, Fla.  Borden and Stark are following a route recommended by Adventure Cycling, which estimates the men should be able to handle 55 miles a day and complete the effort in 63 days. Borden said they expect to do better.  'We expect to do it in six to eight weeks, with about 45 days of actual riding,' he said.While the pair fully expects to enjoy their travels - they will stay in motels and with friends along the way rather than be weighed down with camping gear - the ultimate beneficiary will be Habitat for Humanity's efforts in Addison County.  That effort has already created one home off Route 116 in Middlebury and is nearing completion of another home off Mead Lane in Middlebury. The organization, which builds homes for low-income people (who must contribute time on the project), is already thinking about where to begin the next house in the area, and the $5,000 or more the men plan to raise will provide a major shot in the arm.  All pledges will go directly to Habitat for Humanity as Borden and Stark, both self-employed, will cover their own expenses.  "
68,"Today is the day.  All the rushing around to be prepared and too little sleep blissfully gives way to much needed down time - a 3 hour layover at JFK and a 5-1/2 hour flight.  John picked me up promptly at 5:15 am, with the bikes all loaded in the truck.  We had a little scare as it was starting to rain and the boxes were uncovered in the back of his truck.  A lot of rain  would have rendered the boxes useless for travel.  But thankfully, it remained a sprinkle, and all arrived well.  John had the foresite to dress in shorts for the occasion, despite the Vermont early spring cold.  For me, upon arrival in San Diego, one of the first orders of business was to expose a little leg. John's cousin Frank graciously picked us up at the airport and welcomed us into his home.  Tomorrow we'll assemble the bikes and run any last minute errands before saddling up Saturday morning.     "
69,"VITALS Miles:  25 Average Speed:  ? Final Elevation:  460 feet Today's Climb:  1090 feet Cumulative Climb:  1090 feet Weather:  80's Clear & Beautiful Wind:  West at 10 mph We're off!  We decided do the ceremonial tire dipping in the Pacific today, and incorporate it into our last minute preparations since Frank's house is almost 25 miles east.  Then we can start Saturday past most of the traffic, and at about 400 feet elevation.  We took the Trolley, which is part of San Diego's transit system, down to near the starting point at Dog Beach.  (The trolleys and the buses both take bikes in San Diego - a nice touch.)  As the name implies, it  is indeed a frolic ground for dogs to run around and play with other dogs and the water.         After getting our tires and Johns shoes wet, we were off.  He had been stuck holding both our bikes while I took some photos, and a wave came up from behind.    We followed the San Diego River Floodway on an off-road path for a while, before challenging Friday afternoon rush hour traffic.  Thankfully, most of the roads had a marked lane for bikes, but it was a challenge. We'll be up early tomorrow and be on our way.  We still have to go to the post office in the morning.  We'll be sending back some stuff before we even get started!  I had packed more cold weather clothes than needed after reading journals from previous years showing snow in the mountains early in the ride.  But this year, it's apparent that most of those clothes won't be needed, so home they go.  We'll also send a pedal wrench and bike packing material to a friend in St. Augustine for later use.   "
70,"VITALS Miles:  21 Average Speed:  ? Final Elevation:  1950 feet Today's Climb:  2110 feet Cumulative Climb:  3200  feet Weather:  80's Clear & Beautiful Wind:  West at 10 mph Well, I seem to remember from previous trips that it takes a couple of days to get a rhythm established, and this one is running true to form.  John's brother-in-law Ross is joining us for a couple of days, and met up with us at Frank's.  We were ready to set off to the post office and to get breakfast, but my tire had gone flat overnight and needed to be repaired.  Then what was to be a quick trip to the Post Office took much longer.  The PO didn't open until 9, and John broke off a valve stem and got our second flat of the young trip.  We headed back to Frank's, loaded our gear, and set off for real.  We hadn't gone 100 feet when Ross' rack started acting up.  There was no solution short of a new rack, so back to town we went.  At least our misadventures were equally distributed among the three of us.    It was 1 o'clock when we finally got on the road.  The route followed a gentle grade up through urban East San Diego County.  Traffic gradually thinned out as we climbed to the town of Alpine.  It was great to be on the road at last.  We arranged accommodations and had a nice mexican meal, before retiring, tired but content.   "
71,"VITALS Miles:  17.2   Average Speed:  ?   Final Elevation:  3740 feet   Today's Climb:  2670 feet   Cumulative Climb:  5872  feet   Weather:  80's Clear   Wind:  Gusty 30-35 mph Sunday March 28 Still not quite in our rhythm, we got a late start.  From Alpine we biked through the Sweetwater River watershed which provides water to the San Diego area.  The surrounding vegetation is chaparral, which is highly flammable, resulting in many of the forest fires we've read about in Southern California.  The route takes us to our first stretch of Interstate riding on I-8.  We had 35 mph swirling Santa Ana headwinds/crosswinds which slowed us to a crawl.  One bridge we crossed had a sheer 1000 foot drop off to the side, and when the crosswind blew us that way, it seemed the safer bet to ride closer to the interstate traffic than over to the side.  Fortunately, traffic was light and the bridge fairly short, so we made it through.      We had good roads the whole way, but darned those winds.  Ross turned off to head homeward, and John and I continued to climb to about 4000 feet before descending into Pine Valley.  When we arrived we were trying to decide if we should press on.  I called ahead to see if any rooms were available farther ahead, when one place started telling about their honeymoon suite.  When she got to the part about the mirror over the bed I had to cut her off, as that was an amenity neither John or I were willing to pay extra for.  We decided to stay in Pine Valley at the Pine Valley Inn Motel, where Dan & Ray put up us in a nice clean room and took good care of us for $49.  Pine Valley is a picturesque little town complete with a bike shop, big grocery store, diner, ice cream stand, and a gourmet coffee shop that opened at 5:30 am.     "
